{"content_sections":[{"body":"Explore C1 pilot lesson 8 with original project-authored guidance.","id":"section-1","section_type":"explanation","title":"Focus"},{"body":"Apply the target from C1 pilot lesson 8 in a new context.","id":"section-2","section_type":"practice","title":"Practice"}],"content_status":"UNREVIEWED","duration_minutes":30,"exercises":[{"answer":"option alpha","id":"exercise-1","items":["option alpha","option beta","option gamma"],"prompt":"Choose the best option for C1 pilot lesson 8.","rubric":null,"type":"multiple_choice"},{"answer":"a clear answer","id":"exercise-2","items":[],"prompt":"Complete the sentence in C1 pilot lesson 8.","rubric":null,"type":"fill_blank"},{"answer":null,"id":"exercise-3","items":[],"prompt":"Write one original sentence for C1 pilot lesson 8.","rubric":"meaning is clear; target is used","type":"writing"}],"lesson_id":"m16c1-v1-c1-u02-l03","objectives":["Apply pragmatic, collocational, topical, and strategic choices to institutional choices and formal discussion."],"outline_targets":[{"dimension":"pragmatics","node_id":"kg_c1_1_pragmatics","use":"PRACTISE"},{"dimension":"collocations","node_id":"kg_c1_1_collocations","use":"PRACTISE"},{"dimension":"topics","node_id":"kg_c1_1_topics","use":"PRACTISE"},{"dimension":"skills","node_id":"kg_c1_1_skills","use":"PRACTISE"}],"packet_id":"c1pilot-packet-08","packet_sha256":"5a6ce9804d5c5fe3f2add01d99d89178fa3872bcf4a647457f0fe52abae08ff8","prerequisite_lesson_ids":["m16c1-v1-c1-u02-l02"],"prompts":{"listening":{"constraints":["No external media."],"goal":"Use the target in listening.","instruction":"Practise listening for C1 pilot lesson 8 using an original response."},"pronunciation":{"constraints":["No external media."],"goal":"Use the target in pronunciation.","instruction":"Practise pronunciation for C1 pilot lesson 8 using an original response."},"speaking":{"constraints":["No external media."],"goal":"Use the target in speaking.","instruction":"Practise speaking for C1 pilot lesson 8 using an original response."},"writing":{"constraints":["No external media."],"goal":"Use the target in writing.","instruction":"Practise writing for C1 pilot lesson 8 using an original response."}},"provenance":{"content_input_id":"m16c1-v1-c1-u02-l03","content_origin":"PROJECT_AUTHORED"},"record_type":"c1_pilot_lesson_packet","schema_version":"1.0","sequence":8,"tier":"C1.1","title":"Responding in institutional choices and formal discussion"}
