{"content_sections":[{"body":"Explore C1 pilot lesson 2 with original project-authored guidance.","id":"section-1","section_type":"explanation","title":"Focus"},{"body":"Apply the target from C1 pilot lesson 2 in a new context.","id":"section-2","section_type":"practice","title":"Practice"}],"content_status":"UNREVIEWED","duration_minutes":30,"exercises":[{"answer":"option alpha","id":"exercise-1","items":["option alpha","option beta","option gamma"],"prompt":"Choose the best option for C1 pilot lesson 2.","rubric":null,"type":"multiple_choice"},{"answer":"a clear answer","id":"exercise-2","items":[],"prompt":"Complete the sentence in C1 pilot lesson 2.","rubric":null,"type":"fill_blank"},{"answer":null,"id":"exercise-3","items":[],"prompt":"Write one original sentence for C1 pilot lesson 2.","rubric":"meaning is clear; target is used","type":"writing"}],"lesson_id":"m16c1-v1-c1-u01-l02","objectives":["Develop research findings and source synthesis through clear functions, discourse, and lexical framing."],"outline_targets":[{"dimension":"functions","node_id":"kg_c1_1_functions","use":"INTRODUCE"},{"dimension":"discourse","node_id":"kg_c1_1_discourse","use":"INTRODUCE"},{"dimension":"lexical_chunks","node_id":"kg_c1_1_lexical_chunks","use":"INTRODUCE"}],"packet_id":"c1pilot-packet-02","packet_sha256":"70c0061caa5b56366147152c7c6cdcebad84df79a773549b90343c5a8c32f447","prerequisite_lesson_ids":["m16c1-v1-c1-u01-l01"],"prompts":{"listening":{"constraints":["No external media."],"goal":"Use the target in listening.","instruction":"Practise listening for C1 pilot lesson 2 using an original response."},"pronunciation":{"constraints":["No external media."],"goal":"Use the target in pronunciation.","instruction":"Practise pronunciation for C1 pilot lesson 2 using an original response."},"speaking":{"constraints":["No external media."],"goal":"Use the target in speaking.","instruction":"Practise speaking for C1 pilot lesson 2 using an original response."},"writing":{"constraints":["No external media."],"goal":"Use the target in writing.","instruction":"Practise writing for C1 pilot lesson 2 using an original response."}},"provenance":{"content_input_id":"m16c1-v1-c1-u01-l02","content_origin":"PROJECT_AUTHORED"},"record_type":"c1_pilot_lesson_packet","schema_version":"1.0","sequence":2,"tier":"C1.1","title":"Developing research findings and source synthesis"}
