{"content_sections":[{"body":"Explore C1 pilot lesson 5 with original project-authored guidance.","id":"section-1","section_type":"explanation","title":"Focus"},{"body":"Apply the target from C1 pilot lesson 5 in a new context.","id":"section-2","section_type":"practice","title":"Practice"}],"content_status":"UNREVIEWED","duration_minutes":30,"exercises":[{"answer":"option alpha","id":"exercise-1","items":["option alpha","option beta","option gamma"],"prompt":"Choose the best option for C1 pilot lesson 5.","rubric":null,"type":"multiple_choice"},{"answer":"a clear answer","id":"exercise-2","items":[],"prompt":"Complete the sentence in C1 pilot lesson 5.","rubric":null,"type":"fill_blank"},{"answer":null,"id":"exercise-3","items":[],"prompt":"Write one original sentence for C1 pilot lesson 5.","rubric":"meaning is clear; target is used","type":"writing"}],"lesson_id":"m16c1-v1-c1-u01-l05","objectives":["Review the target dimensions for research findings and source synthesis."],"outline_targets":[{"dimension":"grammar","node_id":"kg_c1_1_grammar","use":"REVIEW"},{"dimension":"vocabulary_senses","node_id":"kg_c1_1_vocabulary_senses","use":"REVIEW"},{"dimension":"functions","node_id":"kg_c1_1_functions","use":"REVIEW"},{"dimension":"pronunciation","node_id":"kg_c1_1_pronunciation","use":"REVIEW"},{"dimension":"discourse","node_id":"kg_c1_1_discourse","use":"REVIEW"},{"dimension":"pragmatics","node_id":"kg_c1_1_pragmatics","use":"REVIEW"},{"dimension":"collocations","node_id":"kg_c1_1_collocations","use":"REVIEW"},{"dimension":"lexical_chunks","node_id":"kg_c1_1_lexical_chunks","use":"REVIEW"},{"dimension":"topics","node_id":"kg_c1_1_topics","use":"REVIEW"},{"dimension":"skills","node_id":"kg_c1_1_skills","use":"REVIEW"}],"packet_id":"c1pilot-packet-05","packet_sha256":"f43590f802e940d0000d8b31ceb7b795d95f15a49d171e1305a27f50f96bb1e7","prerequisite_lesson_ids":["m16c1-v1-c1-u01-l04"],"prompts":{"listening":{"constraints":["No external media."],"goal":"Use the target in listening.","instruction":"Practise listening for C1 pilot lesson 5 using an original response."},"pronunciation":{"constraints":["No external media."],"goal":"Use the target in pronunciation.","instruction":"Practise pronunciation for C1 pilot lesson 5 using an original response."},"speaking":{"constraints":["No external media."],"goal":"Use the target in speaking.","instruction":"Practise speaking for C1 pilot lesson 5 using an original response."},"writing":{"constraints":["No external media."],"goal":"Use the target in writing.","instruction":"Practise writing for C1 pilot lesson 5 using an original response."}},"provenance":{"content_input_id":"m16c1-v1-c1-u01-l05","content_origin":"PROJECT_AUTHORED"},"record_type":"c1_pilot_lesson_packet","schema_version":"1.0","sequence":5,"tier":"C1.1","title":"Review: Research findings and synthesis"}
